ID,Path,Gene,Chromosome,Start,End,Strand,Length,BioType,Description,Flg22_vs_Mock_pvalue,Flg22_vs_Mock_padj,Flg22_vs_Mock_log2FoldChange,Flg22_SynCom33_vs_Mock_pvalue,Flg22_SynCom33_vs_Mock_padj,Flg22_SynCom33_vs_Mock_log2FoldChange,Flg22_SynCom35_vs_Mock_pvalue,Flg22_SynCom35_vs_Mock_padj,Flg22_SynCom35_vs_Mock_log2FoldChange,Flg22_vs_Mock,Flg22_SynCom33_vs_Mock,Flg22_SynCom35_vs_Mock,cl
AT2G31040.1,GO:0033614,CGL160,2,13208624,13211188,-,2564,protein_coding,"Protein CONSERVED ONLY IN THE GREEN LINEAGE 160, chloroplastic [Source:UniProtKB/Swiss-Prot;Acc:O82279]",0.23475137986657954,0.7115481117488706,0.23956538051208845,0.5476724111302979,0.8398320804153431,0.12162399795198406,0.3816855534170527,0.7625470058219112,-0.17801866658375443,0,0,0,7
AT3G29185.2,GO:0033614,,3,11154903,11157275,-,2372,protein_coding,"Glutamate NMDA receptor subunit epsilon-1, putative (DUF3598) [Source:UniProtKB/TrEMBL;Acc:F4J1U2]",0.9983582884561836,0.9997310049539363,-0.0020222650629920314,0.9691084642911825,0.9931674923057469,-0.0380925436265254,0.38479620640150725,NA,0.8442925814536696,0,0,0,4
AT3G29185.1,GO:0033614,,3,11154918,11157293,-,2375,protein_coding,"Glutamate NMDA receptor subunit epsilon-1, putative (DUF3598) [Source:UniProtKB/TrEMBL;Acc:F4J1U2]",0.05091661069400975,0.37901280418546557,-0.7942263343946783,0.9079350181856022,0.9760191297736925,-0.04572641046060882,0.10540466250528953,0.4602714586573519,0.628575858896877,0,0,0,1
AT4G34090.1,GO:0033614,,4,16326883,16330224,-,3341,protein_coding,"unknown protein; FUNCTIONS IN: molecular_function unknown; INVOLVED IN: biological_process unknown; LOCATED IN: chloroplast, chloroplast stroma; EXPRESSED IN: 22 plant structures; EXPRESSED DURING: 13 growth stages; BEST Arabidopsis thaliana protein /.../ is: unknown protein (TAIR:AT2G23370.1); Has 30201 Blast hits to 17322 proteins in 780 species: Archae - 12; Bacteria - 1396; Metazoa - 17338; Fungi - 3422; Plants - 5037; Viruses - 0; Other Eukaryotes - 2996 (source: NCBI BLink). [Source:TAIR;Acc:AT4G34090]",0.8146135893478795,0.9669393485203805,-0.10782037253367155,0.43649392220326994,0.7738088795620645,-0.3614957389566608,0.934948045184552,0.9851661236325965,-0.0373404907321794,0,0,0,3
AT4G34090.2,GO:0033614,,4,16328520,16330212,-,1692,protein_coding,"unknown protein; FUNCTIONS IN: molecular_function unknown; INVOLVED IN: biological_process unknown; LOCATED IN: chloroplast, chloroplast stroma; EXPRESSED IN: 22 plant structures; EXPRESSED DURING: 13 growth stages; BEST Arabidopsis thaliana protein /.../ is: unknown protein (TAIR:AT2G23370.1); Has 30201 Blast hits to 17322 proteins in 780 species: Archae - 12; Bacteria - 1396; Metazoa - 17338; Fungi - 3422; Plants - 5037; Viruses - 0; Other Eukaryotes - 2996 (source: NCBI BLink). [Source:TAIR;Acc:AT4G34090]",0.3111567619761566,0.7773646146730399,-0.9678267973044887,0.9303072845912325,NA,-0.0803492024548718,0.8166730789913373,NA,-0.21329598531339772,0,0,0,10
